{"test_case": {"case_id": "happy_path_1", "persona": "Standard User", "query": "I want to make chicken tinga. What do I need?"}, "final_state": {"request": "I want to make chicken tinga. What do I need?", "intent": "recipe_request", "ingredients_list": ["chicken breast", "onion", "garlic", "tomato", "chipotles in adobo", "chicken broth", "oregano", "bay leaf", "vegetable oil", "salt", "black pepper", "cilantro", "lime", "corn tortilla"], "store_search_results": [{"ingredient": "chicken breast", "store": "Produce Store", "item": "chicken breast", "price": 5.99, "unit": "lb"}, {"ingredient": "onion", "store": "Mexican Store", "item": "onion", "price": 0.99, "unit": "kg"}, {"ingredient": "garlic", "store": "Produce Store", "item": "garlic", "price": 0.75, "unit": "head"}, {"ingredient": "tomato", "store": "Produce Store", "item": "tomatoes", "price": 1.99, "unit": "kg"}, {"ingredient": "chipotles in adobo", "store": "Mexican Store", "item": "chipotles in adobo", "price": 2.99, "unit": "can"}, {"ingredient": "bay leaf", "store": "Mexican Store", "item": "bay leaf", "price": 0.99, "unit": "25g"}, {"ingredient": "salt", "store": "Mexican Store", "item": "cumin & mace salt", "price": 1.99, "unit": "20g"}, {"ingredient": "cilantro", "store": "Mexican Store", "item": "cilantro", "price": 0.99, "unit": "bunch"}, {"ingredient": "lime", "store": "Mexican Store", "item": "lime", "price": 0.45, "unit": "each"}, {"ingredient": "corn tortilla", "store": "Mexican Store", "item": "corn tortillas", "price": 2.5, "unit": "pack"}, {"ingredient": "black pepper", "store": "Mexican Store", "item": "pimienta negra", "price": 2.29, "unit": "50g"}], "shopping_list": "Here is your optimized shopping list:\n- Chicken Breast: $5.99 (lb) at Produce Store\n- Onion: $0.99 (kg) at Mexican Store\n- Garlic: $0.75 (head) at Produce Store\n- Tomatoes: $1.99 (kg) at Produce Store\n- Chipotles In Adobo: $2.99 (can) at Mexican Store\n- Bay Leaf: $0.99 (25g) at Mexican Store\n- Cumin & Mace Salt: $1.99 (20g) at Mexican Store\n- Cilantro: $0.99 (bunch) at Mexican Store\n- Lime: $0.45 (each) at Mexican Store\n- Corn Tortillas: $2.50 (pack) at Mexican Store\n- Pimienta Negra: $2.29 (50g) at Mexican Store\n\nEstimated Total Cost: $21.92\n\nNote: I could not find prices for: chicken broth, oregano, vegetable oil.", "missing_items": ["chicken broth", "oregano", "vegetable oil"], "clarification_question": null}, "metrics": {"agent_path": "recipe_path", "ingredient_find_rate_percent": 78.57142857142857, "total_latency_ms": "38189.85"}}
{"test_case": {"case_id": "off_topic_1_orange_ceiling", "persona": "Off-topic User", "query": "I think orange would have been a better color for my ceiling."}, "final_state": {"request": "I think orange would have been a better color for my ceiling.", "intent": "off_topic", "ingredients_list": [], "store_search_results": [], "shopping_list": null, "missing_items": [], "clarification_question": "What specific Mexican dish would you like to make?"}, "metrics": {"agent_path": "clarification_path", "ingredient_find_rate_percent": 100.0, "total_latency_ms": "5725.24"}}
